Timestamp,Which mockup is a better Login screen design?,Why did you choose one over the other?,How would you rate the design in terms of usability? [Option #1],How would you rate the design in terms of usability? [Option #2],How would you rate the design in terms of completeness? [Option #1],How would you rate the design in terms of completeness? [Option #2],How would you rate the design in terms of familiarity? [Option #1],How would you rate the design in terms of familiarity? [Option #2],How would you rate the design in terms of attractiveness? [Option #1],How would you rate the design in terms of attractiveness? [Option #2],How would you rate the design in terms of consistency? [Option #1],How would you rate the design in terms of consistency? [Option #2],Which mockup is a better Login screen design?,Why did you choose one over the other?,How would you rate the design in terms of usability? [Option #1],How would you rate the design in terms of usability? [Option #2],How would you rate the design in terms of completeness? [Option #1],How would you rate the design in terms of completeness? [Option #2],How would you rate the design in terms of familiarity? [Option #1],How would you rate the design in terms of familiarity? [Option #2],How would you rate the design in terms of attractiveness? [Option #1],How would you rate the design in terms of attractiveness? [Option #2],How would you rate the design in terms of consistency? [Option #1],How would you rate the design in terms of consistency? [Option #2],Which mockup is a better Login screen design?,Why did you choose one over the other?,How would you rate the design in terms of usability? [Option #1],How would you rate the design in terms of usability? [Option #2],How would you rate the design in terms of completeness? [Option #1],How would you rate the design in terms of completeness? [Option #2],How would you rate the design in terms of familiarity? [Option #1],How would you rate the design in terms of familiarity? [Option #2],How would you rate the design in terms of attractiveness? [Option #1],How would you rate the design in terms of attractiveness? [Option #2],How would you rate the design in terms of consistency? [Option #1],How would you rate the design in terms of consistency? [Option #2],Which mockup is a better Login screen design?,Why did you choose one over the other?,How would you rate the design in terms of usability? [Option #1],How would you rate the design in terms of usability? [Option #2],How would you rate the design in terms of completeness? [Option #1],How would you rate the design in terms of completeness? [Option #2],How would you rate the design in terms of familiarity? [Option #1],How would you rate the design in terms of familiarity? [Option #2],How would you rate the design in terms of attractiveness? [Option #1],How would you rate the design in terms of attractiveness? [Option #2],How would you rate the design in terms of consistency? [Option #1],How would you rate the design in terms of consistency? [Option #2],Which mockup is a better Login screen design?,Why did you choose one over the other?,How would you rate the design in terms of usability? [Option #1],How would you rate the design in terms of usability? [Option #2],How would you rate the design in terms of completeness? [Option #1],How would you rate the design in terms of completeness? [Option #2],How would you rate the design in terms of familiarity? [Option #1],How would you rate the design in terms of familiarity? [Option #2],How would you rate the design in terms of attractiveness? [Option #1],How would you rate the design in terms of attractiveness? [Option #2],How would you rate the design in terms of consistency? [Option #1],How would you rate the design in terms of consistency? [Option #2],Which mockup is a better Login screen design?,Why did you choose one over the other?,How would you rate the design in terms of usability? [Option #1],How would you rate the design in terms of usability? [Option  #2],How would you rate the design in terms of completeness? [Option  #2],How would you rate the design in terms of completeness? [Option  #1],How would you rate the design in terms of familiarity? [Option  #2],How would you rate the design in terms of familiarity? [Option  #1],How would you rate the design in terms of attractiveness? [Option  #2],How would you rate the design in terms of attractiveness? [Option  #1],How would you rate the design in terms of consistency? [Option  #2],How would you rate the design in terms of consistency? [Option  #1],Which mockup is a better Login screen design?,Why did you choose one over the other?,How would you rate the design in terms of usability? [Option  #2],How would you rate the design in terms of usability? [Option  #1],How would you rate the design in terms of completeness? [Option  #2],How would you rate the design in terms of completeness? [Option  #1],How would you rate the design in terms of familiarity? [Option  #2],How would you rate the design in terms of familiarity? [Option  #1],How would you rate the design in terms of attractiveness? [Option  #2],How would you rate the design in terms of attractiveness? [Option  #1],How would you rate the design in terms of consistency? [Option  #2],How would you rate the design in terms of consistency? [Option  #1],Which mockup is a better Login screen design?,Why did you choose one over the other?,How would you rate the design in terms of usability? [Option  #1],How would you rate the design in terms of usability? [Option  #2],How would you rate the design in terms of completeness? [Option  #2],How would you rate the design in terms of completeness? [Option  #1],How would you rate the design in terms of familiarity? [Option  #2],How would you rate the design in terms of familiarity? [Option  #1],How would you rate the design in terms of attractiveness? [Option  #2],How would you rate the design in terms of attractiveness? [Option  #1],How would you rate the design in terms of consistency? [Option  #2],How would you rate the design in terms of consistency? [Option  #1],Which mockup is a better Login screen design?,Why did you choose one over the other?,How would you rate the design in terms of usability? [Option  #1],How would you rate the design in terms of usability? [Option #2],How would you rate the design in terms of completeness? [Option  #1],How would you rate the design in terms of completeness? [Option  #2],How would you rate the design in terms of familiarity? [Option  #1],How would you rate the design in terms of familiarity? [Option  #2],How would you rate the design in terms of attractiveness? [Option  #1],How would you rate the design in terms of attractiveness? [Option  #2],How would you rate the design in terms of consistency? [Option  #1],How would you rate the design in terms of consistency? [Option  #2],Which mockup is a better Login screen design?,Why did you choose one over the other?,How would you rate the design in terms of usability? [Option #1],How would you rate the design in terms of usability? [Option  #2],How would you rate the design in terms of completeness? [Option  #1],How would you rate the design in terms of completeness? [Option  #2],How would you rate the design in terms of familiarity? [Option  #1],How would you rate the design in terms of familiarity? [Option  #2],How would you rate the design in terms of attractiveness? [Option  #1],How would you rate the design in terms of attractiveness? [Option  #2],How would you rate the design in terms of consistency? [Option  #1],How would you rate the design in terms of consistency? [Option #2]
6/5/2018 15:46:51,Option 2,I prefer darker backgrounds on average. Less eyestrain.,2,2,2,3,2,2,2,2,2,2,Option 2,More consistent color palette and hierarchy e.g. the two fields aren't the same length at the top of the first design.,2,2,2,2,2,2,2,2,1,2,Option 2,Less garish background color and login with service X buttons.,1,2,1,2,2,2,1,2,2,2,Option 1,Has forgot password link.,2,2,2,2,2,2,2,2,2,2,Option 1,simpler,2,2,2,2,2,2,2,2,2,1,Option 2,big logo,2,2,2,2,2,2,2,2,2,2,Option 2,NA,2,1,3,2,2,2,2,1,2,2,Option 1,yellow/orange blue contrast,2,2,2,2,2,2,2,3,2,2,Option 2,NA,1,2,1,2,2,2,1,2,1,2,Option 2,NA,2,2,2,2,2,2,1,2,2,2
6/6/2018 23:55:51,Option 2,it has more details and is more user friendly with regards to more options,2,3,1,2,3,3,2,3,2,2,Option 1,More details,3,2,1,2,2,2,3,2,2,2,Option 2,A few more options to login and as well as getting help,1,3,1,2,2,3,1,3,1,2,Option 1,Forgot option available,2,1,2,1,2,2,2,1,2,1,Option 2,More complete,1,3,1,3,1,2,2,2,1,2,Option 1,More convinient,3,1,2,3,1,3,1,2,1,3,Option 2,A lot more clearer with details and better choice of size,3,1,3,1,3,1,3,1,3,2,Option 1,Better looking design than the other,2,2,3,3,2,3,3,3,3,2,Option 2,Simpler for user; over all more user friendly,2,3,3,3,3,3,3,3,2,3,Option 2,More options to chose from and better choice of color,2,3,2,3,3,3,2,3,3,3
6/6/2018 23:58:30,Option 2,"This design has sign up, remember me features which are useful for a login screen",3,3,2,3,3,3,3,1,3,2,Option 1,It is a more complete design in the sense that it has options to log in with google or facebook,3,2,3,2,3,3,1,2,2,2,Option 2,Has more features available such as forgot my password,2,2,2,2,3,3,2,2,2,2,Option 1,This design is much better considering that the other design does not even have a log in button,3,1,3,1,3,1,2,1,2,2,Option 2,This design is more complete and less ambiguous ,2,3,2,3,3,2,3,1,3,1,Option 1,Again this is a more complete design,3,2,2,3,3,3,2,2,3,3,Option 2,Option 1 does not have any button while option 2 is so much better in being a more complete design,3,1,3,1,3,1,2,1,2,2,Option 1,"I think it looks much better and is almost as complete as the other design, even though both designs are missing the forgot password field. ",3,3,3,3,3,3,2,3,3,3,Option 2,First design is to busy and would definitely confuse users,2,3,2,3,1,3,1,2,1,2,Option 1,It is a better looking design and lacks the signup button but the other design does not have signup button either.,2,2,2,2,3,3,3,2,3,2
6/7/2018 0:16:22,Option 2,"Completer design, more readable name",1,2,1,2,2,2,2,1,2,2,Option 1,"A Completer UI, Also having signing in options such as google and facebook is always helpful for new users, saves a lot of time.",3,1,3,1,2,1,1,1,1,2,Option 2,"Both are pretty bad, but option 2 offers more options such as help which depending on the application can be very useful.",1,2,1,1,1,1,1,1,2,2,Option 1,"option 2 is very useless since there is no log in button, I cant recognize it as a log in page.",2,1,2,1,2,1,2,1,2,1,Option 1,I am thinking option 1 is a clever design since the option of having trouble can direct users to other pages such as forgot password or username.,2,2,2,2,1,2,2,1,2,1,Option 2,Option 1 does not even have the log in button,1,2,2,1,2,2,2,1,2,1,Option 2,Again option 1 does not have a log in button nor signup,3,1,3,1,2,1,2,1,2,1,Option 2,It is a more complete design considering the google sign in,2,2,2,2,2,2,3,3,3,3,Option 2,Option 2 is much cleaner,2,2,2,2,1,2,1,2,1,2,Option 2,Completer design,2,2,2,2,2,2,2,1,2,2
6/7/2018 2:07:42,Option 2,More interaction options,1,3,1,3,2,2,2,2,3,2,Option 1,looks more complete. logo is misplaced in app-2,3,1,2,1,3,1,2,1,2,1,Option 2,the color combination for app1 is not appropriate,1,3,1,2,1,2,1,2,1,2,Option 1,Looks more complete,2,1,1,1,2,1,1,1,2,1,Option 2,consistent and complete,1,2,1,3,2,3,2,2,3,3,Option 1,more options for the user,3,2,2,3,2,3,2,3,2,3,Option 2,"nicely designed, well-spaced. design-1 does not have anything",3,1,3,1,3,1,2,1,3,2,Option 2,social media options look great,2,3,2,2,3,3,3,3,3,3,Option 2,Design -1 is too clutered,3,2,3,3,2,3,2,3,2,3,Option 2,better colors and more options,2,3,2,3,2,3,1,3,1,3
6/7/2018 2:45:35,Option 2,option-2 has social media options,2,3,2,3,2,2,2,2,2,1,Option 1,good use of social media options,3,2,3,1,3,2,3,1,3,2,Option 2,color combinations are messed up.,1,2,1,2,1,2,1,1,1,1,Option 1,2 is incomplete,2,1,2,1,2,2,1,1,3,2,Option 2,Pretty much covers everything,1,3,1,3,2,3,2,2,3,3,Option 1,both looks pretty good. 1 is complete,3,2,2,3,3,3,3,2,3,3,Option 2,options better spaced. No login button,3,1,3,1,3,1,2,1,3,3,Option 2,better options for the user,2,3,3,2,3,3,3,3,3,3,Option 1,"2 is neater, 1 has better options",3,2,3,3,2,3,2,3,2,3,Option 2,like the baby blue color more,2,3,2,2,3,3,2,3,1,3
6/7/2018 2:46:19,Option 2,some of the options are missing in design-1,2,2,1,3,2,2,2,2,2,1,Option 1,"Remember me option is used, social media options, logo is missed though",2,2,2,1,3,1,3,1,3,3,Option 2,"both are complete, option-2 is slightly better",1,3,1,2,1,1,1,2,1,2,Option 1,option-2 does not have a login button!,2,1,2,1,3,1,2,2,2,2,Option 2,good use of space,2,3,1,3,3,3,1,3,3,3,Option 1,social media options work for me,2,1,2,3,1,2,2,2,2,2,Option 2,it is richer and more complete,2,1,3,1,3,2,2,2,2,2,Option 2,1 has better color combinations but 2 is more useful from user point of view,1,2,3,2,3,3,2,2,3,3,Option 2,"tough choice, going with the tidier design",2,2,3,3,3,3,2,3,2,3,Option 2,"1 not a pleasant design, 2 is more consistent",2,3,2,3,2,3,1,3,1,3